{
  "schemaVersion": "2.0",
  "items": [
    {
      "schemaVersion": "2.0",
      "skillId": "custom.incident-diagnosis",
      "version": "1.0.0",
      "contentDigest": "sha256:811ad7ccbf994e284835e5cabd96636a135b2b81e4fe611e0b7e3f61a54e3731",
      "content": {
        "executionTemplate": "readonly-current-incident-diagnosis-v1",
        "prompt": "Use the permitted current incident evidence. Preserve missing data and label every conclusion as a hypothesis.",
        "outputSchema": "{\"type\":\"object\",\"properties\":{\"summary\":{\"type\":\"string\"}},\"required\":[\"summary\"],\"additionalProperties\":false}",
        "allowedTools": [
          "incident.get@2.0.0",
          "metric.summary@2.0.0",
          "evidence.get@2.0.0"
        ],
        "knowledgeScope": "current",
        "modelPolicyRef": "reasoning-structured-readonly",
        "sideEffects": "forbidden",
        "maxToolCalls": 4,
        "maxEvidence": 2,
        "maxContextBytes": 65536,
        "deadlineMs": 55000,
        "tests": [
          {
            "id": "missing-data",
            "question": "Synthetic Fixture: observations are incomplete.",
            "expectedOutput": "{\"summary\":\"Hypothesis remains unconfirmed because observations are missing.\"}"
          }
        ]
      },
      "review": {
        "approvedAt": "2026-10-15T03:05:00Z"
      },
      "publishedAt": "2026-10-15T03:05:00Z"
    }
  ],
  "nextCursor": null,
  "hasMore": false
}
